Pkt #1 : Ether / IP / TCP 192.0.0.1:ftp_data > 193.0.0.1:12345 S
Pkt #2 : Ether / IP / TCP 192.0.0.1:ftp_data > 193.0.0.1:12345 S
Pkt #3 : Ether / IP / TCP 192.0.0.1:ftp_data > 193.0.0.1:12345 S
Pkt #4 : Ether / IP / TCP 192.0.0.1:ftp_data > 193.0.0.1:12345 S
Pkt #5 : Ether / IP / TCP 192.0.0.1:ftp_data > 193.0.0.1:12345 S
Pkt #6 : Ether / IP / TCP 192.0.0.1:ftp_data > 193.0.0.1:12345 S
Pkt #7 : Ether / IP / TCP 192.0.0.1:ftp_data > 193.0.0.1:12345 S
Pkt #8 : Ether / IP / TCP 192.0.0.1:ftp_data > 193.0.0.1:12345 S
Pkt #9 : Ether / IP / TCP 192.0.0.1:ftp_data > 193.0.0.1:12345 S
Pkt #10 : Ether / IP / TCP 192.0.0.1:ftp_data > 193.0.0.1:12345 S
Pkt #11 : Ether / IP / TCP 192.0.0.1:ftp_data > 193.0.0.1:12345 S
Pkt #12 : Ether / IP / TCP 192.0.0.1:ftp_data > 193.0.0.1:12345 S
Pkt #13 : Ether / IP / TCP 192.0.0.1:ftp_data > 193.0.0.1:12345 S
Pkt #14 : Ether / IP / TCP 192.0.0.1:ftp_data > 193.0.0.1:12345 S
Pkt #15 : Ether / IP / TCP 192.0.0.1:ftp_data > 193.0.0.1:12345 S
Pkt #16 : Ether / IP / TCP 192.0.0.1:ftp_data > 193.0.0.1:12345 S
Pkt #17 : Ether / IP / TCP 192.0.0.1:ftp_data > 193.0.0.1:12345 S
Pkt #18 : Ether / IP / TCP 192.0.0.1:ftp_data > 193.0.0.1:12345 S
Pkt #19 : Ether / IP / TCP 192.0.0.1:ftp_data > 193.0.0.1:12345 S
Pkt #20 : Ether / IP / TCP 192.0.0.1:ftp_data > 193.0.0.1:12345 S
